PDF Name,Page Number,Notes Page Content
SINGAPORE AIRLINES LIMITED 2023.pdf,122,"principal activities of the Group consist of passenger and cargo air transportation, engineering services, training of pilots, air charters, tour activities, sale of merchandise and related activities. The principal activity of the Company consists of passenger and cargo air transportation. The financial statements for the financial year ended 31 March 2023 were authorised for issue in accordance with a resolution of the Board of Directors on 16 May 2023. 2 Summary of Significant Accounting Policies The accounting policies applied by the Group and the Company are consistent with all periods presented in these financial statements, except as explained in note 2(b), which addresses changes in accounting policies. (a) Basis of preparation The financial statements have been prepared in accordance with Singapore Financial Reporting Standards (International) ( SFRS(I) ) and International Financial Reporting Standards ( IFRS ). The financial statements have been prepared on the historical cost basis except as disclosed in the accounting policies below. The financial statements are presented in Singapore Dollars ( SGD ), which is the Company s functional currency and all values in the tables are rounded to the nearest million, unless otherwise stated. (b) Changes in accounting policies The accounting policies adopted are consistent with those of the previous financial year except as follows: On 1 April 2022, the Group adopted all the new and revised standards and interpretations of IFRS ( INT IFRS ) that are effective for annual financial periods beginning on or after 1 April 202"
SINGAPORE POST LIMITED 2023.pdf,121,"principal activities of the Company consist of the operation and provision of postal and parcel delivery services, eCommerce logistics and property. Its subsidiaries are principally engaged in provision of delivery services and eCommerce logistics solutions, provision of integrated supply chain and distributions services, freight forwarding and investment holding. These financial statements were authorised for issue on 5 June 2023 in accordance with a resolution of the Board of Directors of Singapore Post Limited. "
SINGAPORE TELECOMMUNICATIONS LIMITED 2023.pdf,145,"principal activities of the Company consist of the operation and provision of telecommunications systems and services, and investment holding. The principal activities of the significant subsidiaries are disclosed in Note 47. In Singapore, the Group has the rights to provide fixed national and international telecommunications services to 31 March 2037, and public cellular mobile telephone services to 31 March 203"
SITRA HOLDINGS (INTERNATIONAL) LIMITED 2022.pdf,70,"principal activities of the Company are that of investment holding, importers and exporters of wood-based and other related products. The principal activities of its subsidiary corporations are set out in Note 17 to the fi nancial statements. These fi nancial statements were authorised for issue in accordance with a resolution of the Board of Directors of the Company on the date of the Directors  Statement. 2 Signifi cant Accounting Policies "
SPINDEX INDUSTRIES LIMITED 2023.pdf,42,"principal activities of the Company are to carry on the business as importer, exporter and dealer of mechanical, electrical and electronic parts. The principal activities of the subsidiaries are manufacturing and trading of mechanical, electrical, electronic parts, precision machine parts and other engineering materials. "
STARHUB LTD. 2022.pdf,204,"principal activities of the Company are those relating to the operation and provision of telecommunications services and other businesses relating to the info-communications industry. The principal activities of the subsidiaries are set out in Note 7 to the financial statements. The consolidated financial statements relate to the Company and its subsidiaries (together the  Group  and individually as  Group entities ), and the Group s interest in its equity-accounted investees. 2 BASIS OF PREPARATION "
SUNRISE SHARES HOLDINGS LTD. 2022.pdf,59,principal activity of the Company is that of investment holding company. The principal activities of the subsidiaries are disclosed in Note 11 to the financial statements. 2 SUMMARY OF SIGNIFICANT ACCOUNTING POLICIES 
TAI SIN ELECTRIC LIMITED 2023.pdf,82,principal activities of the company are that of cable and wire manufacturer and dealer in such products and investment holding. The principal activities of the subsidiaries and associates are stated in Notes 13 and 14 respectively to the financial statements. The consolidated financial statements of the group and statement of financial position and statement of changes in equity of the company for the year ended 30 June 2023 were authorised for issue by the Board of Directors on 26 September 2023. 
TAT SENG PACKAGING GROUP LTD 2022.pdf,57,"The  The Group is primarily involved in the manufacturing and sales of corrugated paper products and other packaging products. principal activities of the subsidiaries are set out in note 7 to the financial statements. The immediate and ultimate holding company is PSC Corporation Ltd. (formerly known as Hanwell Holdings Limited), incorporated in the Republic of Singapore. 2 BASIS OF PREPARATION 2.1 Statement of compliance The financial statements have been prepared in accordance with Singapore Financial Reporting Standards (International) ( SFRS(I) ). The related changes to significant accounting policies are described in note 2.5. 2.2 Basis of measurement The financial statements have been prepared on the historical cost basis except as otherwise described in the significant accounting policies below. 2.3 Functional and presentation currency The financial statements are presented in Singapore dollars which is the Company s functional currency. 2.4 Use of estimates and judgements The preparation of the financial statements in conformity with SFRS(I)s requires management to make judgements, estimates and assumptions that affect the application of accounting policies and the reported amounts of assets, liabilities, income and expenses. Actual results may differ from these estimates. Estimates and underlying assumptions are reviewed on an ongoing basis. Revisions to accounting estimates are recognised in the period in which the estimates are revised and in any future periods affected. There is no information about critical judgements in applying accounting policies that have the most significant effect on the amounts recognised in the financial statements. Information about key assumptions and judgements that have a significant risk of resulting in material adjustment within the next financial year are in the following notes:  Note 4 and 6   impairment test: key assumptions underlying recoverable amounts of property, plant and equipment and intangible assets"
TELECHOICE INTERNATIONAL LIMITED 2022.pdf,129,"principal activities of the Company during the financial year are investment holding and those of wholesalers, retailers, suppliers, importers, exporters, distributors, agents and dealers of mobile phones, prepaid cards, radio and telecommunication equipment and accessories and the provision of related services. The principal activities of the subsidiaries are set out in Note 6 to the financial statements. The immediate and ultimate holding companies are STT Communications Ltd ( STTC ) and Temasek Holdings (Private) Limited, respectively. These companies are incorporated in the Republic of Singapore. Temasek Holdings (Private) Limited is wholly-owned by the Minister for Finance, a body corporate constituted under the Minister for Finance (Incorporation) Act 1959. 2 Basis of preparation "
TT INTERNATIONAL LIMITED 2023.pdf,56,"principal activities of the Company are those relating to retail, trading and distribution of a wide range of furniture and furnishings, electrical and electronics products and investment holding. The principal activities of the significant subsidiaries are set out in Note 8 to the financial statements. "
UNITED OVERSEAS INSURANCE LIMITED 2022.pdf,4,principal activities are the underwriting 1
VENTURE CORPORATION LIMITED 2022.pdf,107,"principal activities of the Company are to provide manufacturing, product design and development, engineering and supply-chain management services. The principal activities of the subsidiaries are disclosed in Note 11. The consolidated financial statements of the Group and statement of financial position and statement of changes in equity of the Company for the year ended 31 December 202"
VICOM LTD 2022.pdf,78,"principal activities of the Company are those of an investment holding company and the provision of motor vehicle evaluation and other related services. The principal activities of the companies in the Group are in the business of testing services which include the provision of motor vehicle inspection services and provision of non-vehicle testing, inspection and consultancy services, as described in Note 8. The Financial Statements are expressed in Singapore dollars and all values are expressed in thousand ($ 000) except when otherwise indicated. The Consolidated Financial Statements of the Group for the financial year ended 31 December 202"
